number,value,datetime_start,datetime_complete,duration,params_alpha,params_batch_size,params_bottleneck_dim,params_channel_depth,params_dropout,params_learning_rate,params_weight_decay,system_attrs_tpe:relative_params:0,state
0,0.27695994143900665,2026-10-03 13:50:44.083346,2026-10-03 13:53:12.721581,0 days 00:02:28.638235,0.8500000000000001,16,128,wide,0.15000000000000002,0.0007106591851092234,1.0994335574766187e-05,,COMPLETE
1,0.31304502616757934,2026-10-03 13:53:13.881248,2026-10-03 13:54:42.913500,0 days 00:01:29.032252,0.8,16,256,standard,0.05,0.0027991818073277,1.9010245319870364e-05,,COMPLETE
2,0.26439265064571216,2026-10-03 13:59:34.575426,2026-10-03 14:02:35.720656,0 days 00:03:01.145230,0.8500000000000001,16,128,wide,0.15000000000000002,0.0007106591851092234,1.0994335574766187e-05,,COMPLETE
3,0.29307061174641486,2026-10-03 14:02:37.297354,2026-10-03 14:04:30.784893,0 days 00:01:53.487539,0.8,16,256,standard,0.05,0.0027991818073277,1.9010245319870364e-05,,COMPLETE
4,0.3653905417608178,2026-10-03 14:04:30.901081,2026-10-03 14:06:24.000918,0 days 00:01:53.099837,0.7000000000000001,32,128,standard,0.15000000000000002,0.0005878491617603749,1.3492834268013232e-05,,COMPLETE
5,0.2949980704680733,2026-10-03 14:06:24.126748,2026-10-03 14:08:04.887710,0 days 00:01:40.760962,0.65,16,128,compact,0.1,0.0026669003721056773,0.000658628931758311,,PRUNED
6,0.16533826745074728,2026-10-03 14:08:05.041695,2026-10-03 14:09:58.661350,0 days 00:01:53.619655,0.9,16,256,standard,0.25,0.0005443788406047074,0.0001569639638866114,,COMPLETE
7,0.34248731576878094,2026-10-03 14:09:58.787395,2026-10-03 14:13:08.211079,0 days 00:03:09.423684,0.7000000000000001,32,256,wide,0.1,0.002506083226593528,0.00012172847081122418,,PRUNED
8,0.2535523636185605,2026-10-03 14:13:08.398406,2026-10-03 14:16:18.993670,0 days 00:03:10.595264,0.8500000000000001,16,128,wide,0.2,0.00041499749925659886,0.000348771262454593,,COMPLETE
9,0.19342302757760751,2026-10-03 14:16:19.120358,2026-10-03 14:18:01.686351,0 days 00:01:42.565993,0.8500000000000001,16,128,compact,0.05,0.00035576720056725817,0.00018841476921545086,,COMPLETE
10,0.3360719408677972,2026-10-03 14:18:01.819944,2026-10-03 14:19:57.045007,0 days 00:01:55.225063,0.75,16,256,standard,0.25,0.0004934467396872288,0.0006914410984432192,"{""alpha"": 0.75, ""batch_size"": 16, ""bottleneck_dim"": 256, ""channel_depth"": ""standard"", ""dropout"": 0.25, ""learning_rate"": 0.0004934467396872288, ""weight_decay"": 0.0006914410984432192}",PRUNED
11,0.22465609208397244,2026-10-03 14:19:57.215608,2026-10-03 14:21:37.981593,0 days 00:01:40.765985,0.8500000000000001,16,128,compact,0.05,0.0003200281501063189,0.00041797531483537897,"{""alpha"": 0.8500000000000001, ""batch_size"": 16, ""bottleneck_dim"": 128, ""channel_depth"": ""compact"", ""dropout"": 0.05, ""learning_rate"": 0.0003200281501063189, ""weight_decay"": 0.00041797531483537897}",COMPLETE
12,0.18602082586806754,2026-10-03 14:21:38.102748,2026-10-03 14:23:18.994356,0 days 00:01:40.891608,0.8500000000000001,16,128,compact,0.0,0.0004519883110532958,5.179040916294578e-05,"{""alpha"": 0.8500000000000001, ""batch_size"": 16, ""bottleneck_dim"": 128, ""channel_depth"": ""compact"", ""dropout"": 0.0, ""learning_rate"": 0.0004519883110532958, ""weight_decay"": 5.179040916294578e-05}",COMPLETE
13,0.20232207295687302,2026-10-03 14:23:19.146917,2026-10-03 14:25:13.436263,0 days 00:01:54.289346,0.9,16,256,standard,0.15000000000000002,0.0008472866819654312,0.00016538279556583212,"{""alpha"": 0.9, ""batch_size"": 16, ""bottleneck_dim"": 256, ""channel_depth"": ""standard"", ""dropout"": 0.15000000000000002, ""learning_rate"": 0.0008472866819654312, ""weight_decay"": 0.00016538279556583212}",COMPLETE
