number,value,datetime_start,datetime_complete,duration,params_alpha,params_batch_size,params_bottleneck_dim,params_channel_config,params_learning_rate,params_use_residual,system_attrs_tpe:relative_params:0,state
0,0.16008231540520987,2026-10-03 19:11:35.393088,2026-10-03 19:12:56.458371,0 days 00:01:21.065283,0.85,16,64,shallow,0.00043284502212938834,False,,COMPLETE
1,0.4088330864906311,2026-10-03 19:12:57.726932,2026-10-03 19:14:30.645199,0 days 00:01:32.918267,0.65,32,64,standard,0.002595942550311264,False,,COMPLETE
2,0.19840425749619803,2026-10-03 19:14:30.791920,2026-10-03 19:17:20.826413,0 days 00:02:50.034493,0.95,16,64,deep,0.0005954553793888993,True,,COMPLETE
3,0.2632738873362541,2026-10-03 19:17:20.974688,2026-10-03 19:18:54.248804,0 days 00:01:33.274116,0.85,16,128,standard,0.00032925293631105276,False,,COMPLETE
4,0.35521651307741803,2026-10-03 19:18:54.403376,2026-10-03 19:20:15.022249,0 days 00:01:20.618873,0.65,16,128,shallow,0.0008488762161408717,False,,COMPLETE
5,0.14353715380032858,2026-10-03 19:20:15.174945,2026-10-03 19:21:53.754613,0 days 00:01:38.579668,0.95,16,128,standard,0.00045745782054754043,True,,COMPLETE
6,0.3027186393737793,2026-10-03 19:21:53.903321,2026-10-03 19:23:21.523874,0 days 00:01:27.620553,0.8,32,64,shallow,0.00010218376758008094,True,,PRUNED
7,0.2843329906463623,2026-10-03 19:23:21.698826,2026-10-03 19:24:48.806601,0 days 00:01:27.107775,0.8,32,128,shallow,0.0003375589571206087,True,,PRUNED
8,0.3753000994523366,2026-10-03 19:24:48.991645,2026-10-03 19:26:21.749148,0 days 00:01:32.757503,0.65,32,64,standard,0.0007728716861851782,False,,PRUNED
9,0.2721032152573268,2026-10-03 19:26:21.956090,2026-10-03 19:27:47.967969,0 days 00:01:26.011879,0.65,16,128,shallow,0.0002447491657907381,True,,PRUNED
10,0.2230627809961637,2026-10-03 19:27:48.143397,2026-10-03 19:29:27.864293,0 days 00:01:39.720896,0.9,16,128,standard,0.0031016368961728036,True,"{""alpha"": 0.9, ""batch_size"": 16, ""bottleneck_dim"": 128, ""channel_config"": ""standard"", ""learning_rate"": 0.0031016368961728036, ""use_residual"": true}",COMPLETE
11,0.1869132990638415,2026-10-03 19:29:28.051265,2026-10-03 19:30:48.263790,0 days 00:01:20.212525,0.85,16,64,shallow,0.000839530245133649,False,"{""alpha"": 0.85, ""batch_size"": 16, ""bottleneck_dim"": 64, ""channel_config"": ""shallow"", ""learning_rate"": 0.000839530245133649, ""use_residual"": false}",COMPLETE
12,0.15227665255467096,2026-10-03 19:30:48.410382,2026-10-03 19:32:23.914080,0 days 00:01:35.503698,0.95,16,256,standard,0.0006174426263681093,False,"{""alpha"": 0.95, ""batch_size"": 16, ""bottleneck_dim"": 256, ""channel_config"": ""standard"", ""learning_rate"": 0.0006174426263681093, ""use_residual"": false}",COMPLETE
13,0.17482343564430872,2026-10-03 19:32:24.083744,2026-10-03 19:34:00.746341,0 days 00:01:36.662597,0.95,16,256,standard,0.0005359578440927331,False,"{""alpha"": 0.95, ""batch_size"": 16, ""bottleneck_dim"": 256, ""channel_config"": ""standard"", ""learning_rate"": 0.0005359578440927331, ""use_residual"": false}",COMPLETE
14,0.17852744460105896,2026-10-03 19:34:00.937552,2026-10-03 19:35:37.682624,0 days 00:01:36.745072,0.9,16,256,standard,0.00010595825312178404,False,"{""alpha"": 0.9, ""batch_size"": 16, ""bottleneck_dim"": 256, ""channel_config"": ""standard"", ""learning_rate"": 0.00010595825312178404, ""use_residual"": false}",COMPLETE
15,0.3328457772731781,2026-10-03 19:35:37.839478,2026-10-03 19:37:18.557005,0 days 00:01:40.717527,0.95,16,128,standard,0.0010629091138244274,True,"{""alpha"": 0.95, ""batch_size"": 16, ""bottleneck_dim"": 128, ""channel_config"": ""standard"", ""learning_rate"": 0.0010629091138244274, ""use_residual"": true}",PRUNED
