number,value,datetime_start,datetime_complete,duration,params_batch_size,params_channel_config,params_dropout,params_learning_rate,params_weight_decay,system_attrs_tpe:relative_params:0,state
0,0.9782600491151037,2026-10-03 17:28:27.575675,2026-10-03 17:29:40.407574,0 days 00:01:12.831899,16,small,0.45,0.0005611516415334506,0.0006358358856676254,,COMPLETE
1,0.9769704883687581,2026-10-03 17:29:41.281428,2026-10-03 17:30:58.446217,0 days 00:01:17.164789,32,small,0.15000000000000002,0.0026070247583707684,0.00037520558551242813,,COMPLETE
2,0.9782437150141715,2026-10-03 17:30:58.597715,2026-10-03 17:36:27.796844,0 days 00:05:29.199129,32,large,0.4,0.0007309539835912913,3.972110727381908e-05,,COMPLETE
3,0.9700233622584158,2026-10-03 17:36:27.994543,2026-10-03 17:42:09.701630,0 days 00:05:41.707087,64,large,0.5,0.0010677482709481358,0.002661901888489057,,COMPLETE
4,0.9810824693818763,2026-10-03 17:42:09.865532,2026-10-03 17:45:28.237557,0 days 00:03:18.372025,32,medium,0.5,0.0004066563313514797,5.9750279999602906e-05,,COMPLETE
5,0.8563306258958433,2026-10-03 17:45:28.399098,2026-10-03 17:47:30.791577,0 days 00:02:02.392479,64,medium,0.5,0.0021137059440645744,0.004835952776465951,,PRUNED
6,0.9877417176615305,2026-10-03 17:47:30.953757,2026-10-03 17:53:18.384976,0 days 00:05:47.431219,16,large,0.1,0.0015696396388661157,0.003063462210622081,,COMPLETE
7,0.931733242534484,2026-10-03 17:53:18.560207,2026-10-03 17:56:40.184993,0 days 00:03:21.624786,32,large,0.4,0.0005170191786366995,3.9459088110999965e-05,,PRUNED
8,0.9244493775560867,2026-10-03 17:56:40.374814,2026-10-03 17:57:29.225670,0 days 00:00:48.850856,16,small,0.05,0.00010257563974185662,0.0038842777547031426,,PRUNED
9,0.9809633921624503,2026-10-03 17:57:29.360581,2026-10-03 18:00:52.436080,0 days 00:03:23.075499,16,medium,0.45,0.0017643967683381545,0.00026100256506134784,,COMPLETE
10,0.9659456130843884,2026-10-03 18:00:52.587440,2026-10-03 18:05:39.127579,0 days 00:04:46.540139,16,large,0.35000000000000003,0.0059552772910602455,0.0004520450590731462,"{""batch_size"": 16, ""channel_config"": ""large"", ""dropout"": 0.35000000000000003, ""learning_rate"": 0.0059552772910602455, ""weight_decay"": 0.0004520450590731462}",PRUNED
11,0.9823976840688067,2026-10-03 18:05:39.320107,2026-10-03 18:11:32.883395,0 days 00:05:53.563288,16,large,0.25,0.0003718676524723081,0.00018885399475157636,"{""batch_size"": 16, ""channel_config"": ""large"", ""dropout"": 0.25, ""learning_rate"": 0.0003718676524723081, ""weight_decay"": 0.00018885399475157636}",COMPLETE
12,0.9714150384130257,2026-10-03 18:11:33.083382,2026-10-03 18:16:19.236573,0 days 00:04:46.153191,16,large,0.1,0.00031743617884299,0.0006354628186864812,"{""batch_size"": 16, ""channel_config"": ""large"", ""dropout"": 0.1, ""learning_rate"": 0.00031743617884299, ""weight_decay"": 0.0006354628186864812}",PRUNED
13,,2026-10-03 18:16:19.426669,,,16,large,0.15000000000000002,0.0018757433453312998,0.005250494644331518,"{""batch_size"": 16, ""channel_config"": ""large"", ""dropout"": 0.15000000000000002, ""learning_rate"": 0.0018757433453312998, ""weight_decay"": 0.005250494644331518}",RUNNING
